{
  "schema_version": "0.1.0",
  "standard": "pybravo.bravo-capability-manifest",
  "context_hash": "9a0f7e8a0c20b937690d7a1623c416524c859b84c06e885572f199a689dbc4ea",
  "machine": {
    "machine_id": "SIMULATED",
    "profile_name": "simulation",
    "controller_type": "simulation",
    "head_type": "HT_384_D_70",
    "geometry": {
      "rows": 16,
      "columns": 24,
      "pitch_x_mm": 4.5,
      "pitch_y_mm": 4.5
    },
    "has_gripper": true,
    "deck_slots": [
      1,
      2,
      3,
      4,
      5,
      6,
      7,
      8,
      9
    ],
    "max_operations": 500,
    "head_max_volume_ul": 250.0
  },
  "assistant_operations": [
    {
      "id": "transfer",
      "description": "Move a per-channel volume between addressed source and destination wells.",
      "selectable": true,
      "availability": "available",
      "parameters": [
        {
          "name": "source",
          "type": "string",
          "required": true
        },
        {
          "name": "destination",
          "type": "string",
          "required": true
        },
        {
          "name": "source_anchor",
          "type": "string",
          "required": true
        },
        {
          "name": "destination_anchor",
          "type": "string",
          "required": true
        },
        {
          "name": "volume_ul",
          "type": "number",
          "required": true,
          "unit": "uL"
        }
      ],
      "preconditions": [
        "disposable_head",
        "compatible_tip_pair",
        "confirmed_tip_inventory",
        "approved_liquid_class",
        "reachable_wells",
        "source_and_destination_capacity"
      ],
      "effects": [
        "source_volume_decreased",
        "destination_volume_increased"
      ],
      "lowers_to": [
        "liquid/Aspirate",
        "liquid/Dispense"
      ]
    },
    {
      "id": "mix",
      "description": "Aspirate and dispense repeatedly within one addressed material.",
      "selectable": true,
      "availability": "available",
      "parameters": [
        {
          "name": "material",
          "type": "string",
          "required": true
        },
        {
          "name": "anchor",
          "type": "string",
          "required": true
        },
        {
          "name": "volume_ul",
          "type": "number",
          "required": true,
          "unit": "uL"
        },
        {
          "name": "cycles",
          "type": "integer",
          "required": true
        }
      ],
      "preconditions": [
        "disposable_head",
        "compatible_tip_pair",
        "confirmed_tip_inventory",
        "approved_liquid_class",
        "reachable_wells",
        "source_and_destination_capacity"
      ],
      "effects": [
        "material_mixed"
      ],
      "lowers_to": [
        "liquid/Mix"
      ]
    },
    {
      "id": "move_plate",
      "description": "Move a single accessible plate to an empty deck position.",
      "selectable": true,
      "availability": "available",
      "parameters": [
        {
          "name": "material",
          "type": "string",
          "required": true
        },
        {
          "name": "destination_slot",
          "type": "integer",
          "required": true
        }
      ],
      "preconditions": [
        "configured_gripper",
        "top_plate_access",
        "deck_destination_available"
      ],
      "effects": [
        "plate_relocated"
      ],
      "lowers_to": [
        "plate/PickPlace"
      ]
    },
    {
      "id": "destack_plate",
      "description": "Remove the top plate from a stack into an empty position.",
      "selectable": true,
      "availability": "available",
      "parameters": [
        {
          "name": "material",
          "type": "string",
          "required": true
        },
        {
          "name": "destination_slot",
          "type": "integer",
          "required": true
        }
      ],
      "preconditions": [
        "configured_gripper",
        "top_plate_access",
        "source_stack_has_multiple_plates",
        "deck_destination_available"
      ],
      "effects": [
        "plate_relocated",
        "source_stack_decreased"
      ],
      "lowers_to": [
        "plate/Destack"
      ]
    },
    {
      "id": "stack_plate",
      "description": "Place an accessible plate on a compatible occupied stack.",
      "selectable": true,
      "availability": "available",
      "parameters": [
        {
          "name": "material",
          "type": "string",
          "required": true
        },
        {
          "name": "destination_slot",
          "type": "integer",
          "required": true
        }
      ],
      "preconditions": [
        "configured_gripper",
        "top_plate_access",
        "compatible_destination_stack"
      ],
      "effects": [
        "plate_relocated",
        "destination_stack_increased"
      ],
      "lowers_to": [
        "plate/Stack"
      ]
    },
    {
      "id": "wait",
      "description": "Wait for a specified elapsed duration; no temperature control is implied.",
      "selectable": true,
      "availability": "available",
      "parameters": [
        {
          "name": "duration_s",
          "type": "number",
          "required": true,
          "unit": "s"
        }
      ],
      "preconditions": [
        "positive_duration"
      ],
      "effects": [
        "elapsed_time"
      ],
      "lowers_to": [
        "system/Wait"
      ]
    },
    {
      "id": "manual",
      "description": "Pause for a stated operator action or external instrument handoff.",
      "selectable": true,
      "availability": "available",
      "parameters": [
        {
          "name": "message",
          "type": "string",
          "required": true
        },
        {
          "name": "duration_s",
          "type": "number",
          "required": false,
          "unit": "s"
        }
      ],
      "preconditions": [
        "operator_instruction"
      ],
      "effects": [
        "operator_checkpoint"
      ],
      "lowers_to": [
        "system/Manual"
      ]
    },
    {
      "id": "repeat",
      "description": "Repeat a bounded sequence of assistant steps.",
      "selectable": true,
      "availability": "available",
      "parameters": [
        {
          "name": "repeat",
          "type": "integer",
          "required": true
        },
        {
          "name": "steps",
          "type": "array",
          "required": true
        }
      ],
      "preconditions": [
        "bounded_repeat"
      ],
      "effects": [
        "steps_repeated"
      ],
      "lowers_to": []
    }
  ],
  "robot_operations": [
    {
      "id": "tips/TipsOn",
      "description": "Pick up the validated tip footprint from a confirmed supply rack.",
      "model_selectable": false,
      "availability": "available"
    },
    {
      "id": "tips/TipsOff",
      "description": "Return or discard the loaded tip footprint according to setup.",
      "model_selectable": false,
      "availability": "available"
    },
    {
      "id": "liquid/Aspirate",
      "description": "Aspirate liquid from the addressed source wells.",
      "model_selectable": false,
      "availability": "available"
    },
    {
      "id": "liquid/Dispense",
      "description": "Dispense liquid into the addressed destination wells.",
      "model_selectable": false,
      "availability": "available"
    },
    {
      "id": "liquid/Mix",
      "description": "Perform repeated aspiration and dispense at one location.",
      "model_selectable": false,
      "availability": "available"
    },
    {
      "id": "plate/PickPlace",
      "description": "Move an accessible plate with the configured gripper.",
      "model_selectable": false,
      "availability": "available"
    },
    {
      "id": "plate/Stack",
      "description": "Place a plate onto a compatible existing stack.",
      "model_selectable": false,
      "availability": "available"
    },
    {
      "id": "plate/Destack",
      "description": "Remove the top plate from a stack.",
      "model_selectable": false,
      "availability": "available"
    },
    {
      "id": "system/Wait",
      "description": "Run a timed wait.",
      "model_selectable": false,
      "availability": "available"
    },
    {
      "id": "system/Manual",
      "description": "Pause for an operator checkpoint.",
      "model_selectable": false,
      "availability": "available"
    }
  ],
  "tipbox_choices": [
    {
      "labware_id": "lw-4914769d0af7",
      "labware_name": "384 V11 ST10 Tip Box 10734.102",
      "tip_definition_id": "st_10ul",
      "tip_name": "10 uL",
      "rows": 16,
      "cols": 24,
      "wells": 384,
      "spacing_x_mm": 4.5,
      "spacing_y_mm": 4.5,
      "tip_capacity_ul": 10.0,
      "tip_length_mm": 19.9,
      "execution_ready": true,
      "missing_metadata": [],
      "status": "catalog_verified",
      "provenance": "active_head_catalog_pair"
    },
    {
      "labware_id": "lw-4914769d0af7",
      "labware_name": "384 V11 ST10 Tip Box 10734.102",
      "tip_definition_id": "st_70ul",
      "tip_name": "70 uL",
      "rows": 16,
      "cols": 24,
      "wells": 384,
      "spacing_x_mm": 4.5,
      "spacing_y_mm": 4.5,
      "tip_capacity_ul": 70.0,
      "tip_length_mm": null,
      "execution_ready": false,
      "missing_metadata": [
        "tip_length"
      ],
      "status": "planning_only",
      "provenance": "active_head_catalog_pair"
    }
  ],
  "tipbox_catalog_candidates": [],
  "labware": [
    {
      "id": "01KD4P500RXXP69X03R0SDGS7C",
      "name": "96 Costar 3596 clear cell culture PS flt btm",
      "kind": "sbs_plate",
      "base_class": "microplate",
      "wells": 96,
      "rows": 8,
      "cols": 12,
      "spacing_x_mm": 9.0,
      "spacing_y_mm": 9.0,
      "well_volume_ul": 0.0,
      "well_depth_mm": 10.75,
      "height_mm": 14.3,
      "stack_height_mm": 13.0,